dataset_id,title,organization,dataset_source,license_title,tags,formats,notes_snippet
c603cb07-724d-4d3d-88f8-0b3e7ebcde68,"Somalia - Water Price Monitoring for Gedo Region, March 2017",REACH Initiative,REACH Initiative,Public Domain / No restrictions (CC0),indicators;markets;water sanitation and hygiene-wash,xls,"Water Price Monitoring in Gedo Region, March 2017"
2e836911-cd65-4afb-ac67-ba73b17ad01c,Congo: Flood - 346099.0 sq m - Nov 2023,WFP Advanced Disaster Analysis & Mapping,WFP ADAM,Creative Commons Attribution Share-Alike (CC BY-SA),flooding;geodata,geojson;geopackage;geotiff;txt,<strong>ADAM ID: FL-20231121-COG-02</strong> Flood covering 346099.0 sq m on Nov 21 2023 in Congo. It impacted 43821 people.
2f8019a2-ed05-4203-b11f-08cf9550a178,Kazakhstan - IFRC Appeals,International Federation of Red Cross and Red Crescent Societies (IFRC),IFRC,Creative Commons Attribution for Intergovernmental Organisations (CC BY-IGO),funding;hxl,csv,"The International Federation of Red Cross and Red Crescent Societies (IFRC) is the world’s largest humanitarian network. Our secretariat supports local Red Cross and Red Crescent action in more than 192 countries, bringing together almost 15 million volunteers for the good of humanity. We launch Emergency Appeals for big and complex disasters affec…"
f4f30105-6aa0-4165-a2f1-d208db6d9a54,Learning levels in Kenya (2015),Uwezo at Twaweza East Africa (inactive),Uwezo at Twaweza East Africa,Creative Commons Attribution International (CC BY),,csv,"These datasets contains data relevant to learner achievement in Kenya. This ranges from school enrollment, socioeconomic indicators, school infrastructure among others."
b01c7e1f-2968-44b7-a207-d530510fc90e,Malta - Education Indicators,UNESCO,UNESCO Institute for Statistics (UIS),Creative Commons Attribution for Intergovernmental Organisations (CC BY-IGO),demographics;education;hxl;indicators;socioeconomics;sustainable development;sustainable development goals-sdg,csv,"Education indicators for Malta. Contains data from the UNESCO Institute for Statistics <a href=""http://data.uis.unesco.org"">bulk data service</a> covering the following categories: SDG 4 Global and Thematic (made 2025 February), Other Policy Relevant Indicators (made 2025 February), Demographic and Socio-economic (made 2025 February)"
cc4eff2a-7efa-4927-92a2-598cd03d891f,Angola - Current IATI Aid Activities,International Aid Transparency Initiative,Various IATI reporting organisations,Other,funding;hxl;who is doing what and where-3w-4w-5w,csv,"List of active aid activities shared via the International Aid Transparency Initiative (IATI). Includes both humanitarian and development activities. More information on each activity (including financial data) is available from <a href=""http://www.d-portal.org"">http://www.d-portal.org</a>"
3d18e317-3d48-4eb0-83fa-c54c4231aa20,Central America - Hazards from Violent Events,Acción contra el hambre - GIS4tech,Acción contra el hambre - GIS4tech,Creative Commons Attribution International (CC BY),conflict-violence,xlsx,"Different types of violent events reported by ACLED are recorded of the countries of El Salvador, Guatemala, Honduras, and Nicaragua at the municipal level. Each column defines a threat category for the municipality: No Risk, Low Threat, Moderate Threat, and Severe Threat. The final column shows the overall summary of global threats. This calculati…"
6260df54-ebf8-4914-bc00-8a05ae5b6027,Thailand - Social Development,World Bank Group,World Bank,Creative Commons Attribution International (CC BY),development;hxl;indicators,csv,"Contains data from the World Bank's <a href=""http://data.worldbank.org/"">data portal</a>. There is also a <a href=""https://data.humdata.org/dataset/world-bank-combined-indicators-for-thailand"">consolidated country dataset</a> on HDX. Data here cover child labor, gender issues, refugees, and asylum seekers. Children in many countries work long hours…"
c3d8899b-11d9-4946-8987-89fe2b2b7c15,Nigeria: Acute Food Insecurity Country Data,Integrated Food Security Phase Classification (IPC),National IPC Technical Working Group,Public Domain / No restrictions (CC0),food security;integrated food security phase classification-ipc,csv;geojson,"The IPC Acute Food Insecurity (IPC AFI) classification provides strategically relevant information to decision makers that focuses on short-term objectives to prevent, mitigate or decrease severe food insecurity that threatens lives or livelihoods. This data has been produced by the National IPC Technical Working Groups for IPC population estimates…"
e157a712-ae8a-4675-8f46-4120e43bf6ae,State of Palestine Closures Barriers,OCHA occupied Palestinian territory (oPt),Peace Now and OCHA oPt,Creative Commons Attribution for Intergovernmental Organisations (CC BY-IGO),geodata;humanitarian access,geodatabase;shp,"Closures, Barriers in the occupied Palestinian territory."
9c6a7a78-a40e-4795-9b8f-6473e8ebdd46,Aruba - Pregnancies,WorldPop,"WorldPop, University of Southampton, UK",Other,geodata;maternity,geotiff,"The health and survival of women and their new-born babies in low income countries is a key public health priority, but basic and consistent subnational data on the number of pregnancies to support decision making has been lacking. WorldPop integrates small area data on the distribution of women of childbearing age, age-specific fertility rates, st…"
4e75feb0-721b-4d84-beaf-75aadf51c470,Latvia - Millenium development goals,World Bank Group,World Bank,Creative Commons Attribution International (CC BY),hxl;indicators;sustainable development goals-sdg,csv,"Contains data from the World Bank's <a href=""http://data.worldbank.org/"">data portal</a>. There is also a <a href=""https://data.humdata.org/dataset/world-bank-combined-indicators-for-latvia"">consolidated country dataset</a> on HDX."
c8521f9a-a0ec-406b-839f-dcd4065d63f1,Qatar - Education Indicators,UNESCO,UNESCO Institute for Statistics (UIS),Creative Commons Attribution for Intergovernmental Organisations (CC BY-IGO),demographics;education;hxl;indicators;socioeconomics;sustainable development;sustainable development goals-sdg,csv,"Education indicators for Qatar. Contains data from the UNESCO Institute for Statistics <a href=""http://data.uis.unesco.org"">bulk data service</a> covering the following categories: SDG 4 Global and Thematic (made 2025 February), Other Policy Relevant Indicators (made 2025 February), Demographic and Socio-economic (made 2025 February)"
4aa4ea81-542d-44c6-bcf8-7a069978b179,Central African Republic - Energy and Mining,World Bank Group,World Bank,Creative Commons Attribution International (CC BY),development;energy;hxl;indicators,csv,"Contains data from the World Bank's <a href=""http://data.worldbank.org/"">data portal</a>. There is also a <a href=""https://data.humdata.org/dataset/world-bank-combined-indicators-for-central-african-republic"">consolidated country dataset</a> on HDX. The world economy needs ever-increasing amounts of energy to sustain economic growth, raise living s…"
73c3eedb-d51d-478d-87ef-c5085422ef1b,Ukraine: JIAF Humanitarian Needs and Response Plan,OCHA Ukraine,Humanitarian partners,Creative Commons Attribution International (CC BY),affected population;humanitarian needs overview-hno;humanitarian response plan-hrp;hxl;people in need-pin,pdf;xlsx,"The dataset provides a full breakdown of the affected population, PiN, severity and planned reach by strategic priority, cluster, and population group. As applicable, estimates of age and gender disaggregation are also included, along with estimates of people with disability. A detailed list of the HNRP activities is also included, along with a ref…"
93872ad7-ce67-4a71-a812-277dc486506e,Qatar - Gender,World Bank Group,World Bank,Creative Commons Attribution International (CC BY),gender;hxl;indicators,csv,"Contains data from the World Bank's <a href=""http://data.worldbank.org/"">data portal</a>. There is also a <a href=""https://data.humdata.org/dataset/world-bank-combined-indicators-for-qatar"">consolidated country dataset</a> on HDX. Gender equality is a core development objective in its own right. It is also smart development policy and sound busines…"
f922be53-fdd6-483d-a4ee-a9612997d4f9,"Flood Impact assessment of the Capital city of Kathmandu, Bagmati Province, Nepal as of 30 September 2024",United Nations Satellite Centre (UNOSAT),UN Operational Satellite Applications Programme (UNOSAT),Creative Commons Attribution Share-Alike (CC BY-SA),flooding;geodata,geodatabase;shp,"<strong>UNOSAT code: FL20240928NPL</strong> This map illustrates the floods using the Spot-6 image acquired on 30 September 2024 at 14:20 local time (08:35 UTC). Within the analysed area of about 450 km², a total of about 8 km² of land appears to be affected by flood waters. and about 4 km² of cropland seems to be inundated. Based on Worldpop spati…"
8a063208-722d-41c3-925d-fe234a5a6fda,Argentina - Science and Technology,World Bank Group,World Bank,Creative Commons Attribution International (CC BY),economics;hxl;indicators,csv,"Contains data from the World Bank's <a href=""http://data.worldbank.org/"">data portal</a>. There is also a <a href=""https://data.humdata.org/dataset/world-bank-combined-indicators-for-argentina"">consolidated country dataset</a> on HDX. Technological innovation, often fueled by governments, drives industrial growth and helps raise living standards. D…"
a2237c26-863e-46b5-8863-e60cdbb1f47c,Vietnam - Education,World Bank Group,World Bank,Creative Commons Attribution International (CC BY),education;hxl;indicators,csv,"Contains data from the World Bank's <a href=""http://data.worldbank.org/"">data portal</a>. There is also a <a href=""https://data.humdata.org/dataset/world-bank-combined-indicators-for-vietnam"">consolidated country dataset</a> on HDX. Education is one of the most powerful instruments for reducing poverty and inequality and lays a foundation for susta…"
bff76cf0-7ab0-4a92-842d-1096ce3086d2,Sint Maarten (Dutch part) - Historical Health Indicators,World Health Organization,World Health Organization,Other,hxl;indicators,csv,"This dataset contains historical data from WHO's <a href=""https://www.who.int/gho/en/"">data portal</a>."
a6c018c9-d1fd-433c-a9a9-67c8d569a2e1,Ukraine: Baseline Population in Donetska and Luhanska Oblasts,OCHA Ukraine,OCHA Ukraine,Creative Commons Attribution International (CC BY),baseline population;gender and age disaggregated data-gadd;hxl;internally displaced persons-idp,xlsx,"Ukraine estimated baseline population data (residents and IDPs) in Donetska and Luhanska oblasts used in 2022 HNO with SAAD disaggregation at adm1, GCA/NGCA and zone (distance from contact line) level. Estimation is based on 2001 census."
2ce03da9-d574-41e6-b554-b3afeb2114e6,Czechia: IBTrACS Storm Tracks,HDX,National Oceanic and Atmospheric Administration (NOAA) / National Centers for Environmental Information (NCEI),Creative Commons Attribution for Intergovernmental Organisations (CC BY-IGO),cyclones-hurricanes-typhoons;hxl,csv;geojson,"The International Best Track Archive for Climate Stewardship (IBTrACS) project is the most complete global collection of tropical cyclones available. It merges recent and historical tropical cyclone data from multiple agencies to create a unified, publicly available, best-track dataset that improves inter-agency comparisons. Fields available: SID: …"
5be2197a-bd1d-4591-b39f-be7b1558005b,United Kingdom of Great Britain and Northern Ireland - Population Counts,WorldPop,"WorldPop, University of Southampton, UK",Other,baseline population;geodata,geotiff,"<b>WorldPop produces different types of gridded population count datasets, depending on the methods used and end application. Please make sure you have read our <a href=""https://www.worldpop.org/methods/populations"">Mapping Populations</a> overview page before choosing and downloading a dataset.</b> Bespoke methods used to produce datasets for spec…"
53563626-105b-4eb5-94bc-e36207492215,GAR15 Global Exposure Dataset for Gambia,United Nations Office for Disaster Risk Reduction (UNDRR),UNISDR,Other,disaster risk reduction-drr;geodata;hazards and risk,shp,"The GAR15 global exposure database is based on a top-down approach where statistical information including socio-economic, building type, and capital stock at a national level are transposed onto the grids of 5x5 or 1x1 using geographic distribution of population data and gross domestic product (GDP) as proxies."
183d153e-1632-4b18-9e9c-2ce26ca8af47,"Landslides impact analysis in Melamchi Municipality, Bagmati province, Nepal as of 24 June 2021",United Nations Satellite Centre (UNOSAT),UN Operational Satellite Applications Programme (UNOSAT),Creative Commons Attribution Share-Alike (CC BY-SA),flooding;geodata,geodatabase;shp,"<strong>UNOSAT code: FL20210630NPL</strong> This map illustrates satellite-detected flash floods and landslides in Melamchi village, Melamchi Municipality, Bagmati province, Nepal as observed using Sentinel-2 satellite imagery acquired on 24 June 2021. Within the analyzed area, approximately 150 structures appear to be potentially affected by the l…"
7d569e8a-11ba-470e-a837-53dc13b3ef2a,Zimbabwe - Population Counts,WorldPop,"WorldPop, University of Southampton, UK",Other,baseline population;geodata,geotiff,"<b>WorldPop produces different types of gridded population count datasets, depending on the methods used and end application. Please make sure you have read our <a href=""https://www.worldpop.org/methods/populations"">Mapping Populations</a> overview page before choosing and downloading a dataset.</b> Bespoke methods used to produce datasets for spec…"
081b803b-a1d0-48f4-b8f2-af27e17c3d1c,Kazakhstan - Public Sector,World Bank Group,World Bank,Creative Commons Attribution International (CC BY),economics;hxl;indicators,csv,"Contains data from the World Bank's <a href=""http://data.worldbank.org/"">data portal</a>. There is also a <a href=""https://data.humdata.org/dataset/world-bank-combined-indicators-for-kazakhstan"">consolidated country dataset</a> on HDX. Effective governments improve people's standard of living by ensuring access to essential services – health, educa…"
da907f53-6c4d-42b1-be0d-aea294492dc0,Central African Republic - Conservation Series (Sout - West CAR),OCHA Central African Republic,"World Resources Institute (WRI), Projet d'Appui à la Réalisation des Plans d'Aménagement Forestiers (PARPAF) et au World Resources Institute pour les modifications apportées. ",Other,geodata,shp,"This GIS layer represents the forest series and was created by the project to support the achievement of forest management plans ( PARPAF ), from socio-economic studies and dendrometric inventories , to achieve different management series ( series production , conservation series , etc. ) . There are several types of sets: Production , Conservation…"
cdd62bd9-e442-4eac-9b44-cfee8bf79153,South Sudan - Subnational Administrative Boundaries,OCHA South Sudan,"South Sudan Information Management Working Group (IMWG), National Bureau of Statistics (NBS), International Organization for Migration (IOM) and OCHA",Creative Commons Attribution for Intergovernmental Organisations (CC BY-IGO),administrative boundaries-divisions;gazetteer,emf;geodatabase;shp;xlsx,South Sudan administrative level 0-3 boundaries (COD-AB) dataset. These administrative boundaries were established in: 2020 NOTE: Ages disaggregated into only four cohorts. No COD-PS record for Abyei Region. See COD-PS caveat about data rounding. The geoservice layer and the pak_admbndl_admALL_ocha_itos_20230308 lines shapefile contains the followi…
553dd182-3b65-47f7-b3c0-b48dc8eb8d4b,Iraq: Population Density for 400m H3 Hexagons,Kontur,kontur,Creative Commons Attribution International (CC BY),baseline population;geodata;population,geopackage,"Iraq population density for 400m H3 hexagons. Built from <a href=""https://data.humdata.org/dataset/kontur-population-dataset"">Kontur Population: Global Population Density for 400m H3 Hexagons</a> Vector H3 hexagons with population counts at 400m resolution. Fixed up fusion of GHSL, Facebook, Microsoft Buildings, Copernicus Global Land Service Land …"
da99d14a-d290-4e29-85c2-5de20c61da15,Zambia Current Situation FEWS NET Acute Food Insecurity Classifications Data,FEWS NET,FEWS NET,Creative Commons Attribution International (CC BY),food security,csv;geojson;json;kml;xlsx,Zambia Current Situation FEWS NET Acute Food Insecurity Classifications Data from 2011
518f4881-adca-4d16-a4e8-f89165761eba,HDX HAPI Data for Türkiye,HDX Humanitarian API Data,"Armed Conflict Location & Event Data Project (ACLED), INFORM, OCHA Financial Tracking System (FTS), UNFPA, UNHCR - The UN Refugee Agency, WFP - World Food Programme",Other,baseline population;climate-weather;conflict-violence;economics;food security;funding;hazards and risk;indicators;markets;refugees;returnees,csv,"This dataset contains data obtained from the <a href=""https://hapi.humdata.org/"">HDX Humanitarian API</a> (HDX HAPI), which provides standardized humanitarian indicators designed for seamless interoperability from multiple sources. The data facilitates automated workflows and visualizations to support humanitarian decision making. For more informat…"
02d7d277-0934-4629-8b5b-187e041ee74b,Coastal proximity of populations in 22 Pacific Island Countries and Territories - Dataset - Fiji,Pacific Community,SPC Statistics for Development Division (SDD),Creative Commons Attribution International (CC BY),demographics;population,geojson;txt;zipped tif,"Spatial datasets utilized to conduct the spatial analysis and additional information from the research article: Coastal proximity of populations in 22 Pacific Island Countries and Territories. https://journals.plos.org/plosone/article?id=10.1371/journal.pone.0223249 https://sdd.spc.int/mapping-coastal <em>Access this dataset from the <a href=""https…"
1ad1270c-f794-450c-8c05-3d56b271fb6c,"Egypt, Arab Rep. - Economic, Social, Environmental, Health, Education, Development and Energy",World Bank Group,World Bank,Creative Commons Attribution International (CC BY),agriculture-livestock;aid effectiveness;climate-weather;development;economics;education;energy;environment;facilities-infrastructure;gender;health;hxl;indicators;poverty;socioeconomics;trade,csv,"Contains data from the World Bank's <a href=""http://data.worldbank.org/"">data portal</a> covering the following topics which also exist as individual datasets on HDX: <a href=""https://data.humdata.org/dataset/world-bank-agriculture-and-rural-development-indicators-for-egypt-arab-rep"">Agriculture and Rural Development</a>, <a href=""https://data.humd…"
ea607346-1c3a-4d60-82ac-09a74ebc9f01,Oman - Health Indicators,World Health Organization,World Health Organization,Other,disability;disease;environment;health;hxl;indicators;malaria;maternity;mental health;nutrition;vaccination-immunization,csv,"This dataset contains data from WHO's <a href=""https://www.who.int/gho/en/"">data portal</a> covering the following categories: Adolescent, Ageing, Air pollution, Assistive technology, Child, Child mortality, Cross-cutting, Dementia diagnosis, treatment and care, Environment and health, Food safety, Global Dementia Observatory (GDO), Global Health E…"
1670ffae-2ff4-45a7-993d-98b250ea19c2,Afghanistan Current Situation FEWS NET Acute Food Insecurity Classifications Geographic Data for 2011,FEWS NET,FEWS NET,Creative Commons Attribution International (CC BY),food security;integrated food security phase classification-ipc,geojson;kml,The FEWS NET Data Warehouse is <strong>currently unavailable</strong>. Datasets on HDX that refer to the Data Warehouse have been archived. Afghanistan Current Situation FEWS NET Acute Food Insecurity Classifications Geographic data for 2011
54ad844d-855e-4fe2-885e-f669cb8951a5,Time series Evolution flood satellite detected waters 13 - 29 July 2018,United Nations Satellite Centre (UNOSAT),UNOSAT,Creative Commons Attribution Share-Alike (CC BY-SA),flooding;geodata,shp,"This analysis illustrates a time series analysis of the evolution of satellite-detected surface waters in Sanamxay district, Attapeu province, based on satellite data recorded on 13, 25 and 29 July 2018."
197b9c6b-cf5e-4e0c-b44d-2e31f8e12133,Marshall Islands - Public Sector,World Bank Group,World Bank,Creative Commons Attribution International (CC BY),economics;hxl;indicators,csv,"Contains data from the World Bank's <a href=""http://data.worldbank.org/"">data portal</a>. There is also a <a href=""https://data.humdata.org/dataset/world-bank-combined-indicators-for-marshall-islands"">consolidated country dataset</a> on HDX. Effective governments improve people's standard of living by ensuring access to essential services – health,…"
0c0e0d65-16cc-4ef7-880c-85184448d548,"Geodata of Landslide induced dam over Tonzang Township, Chin Division, Myanmar",United Nations Satellite Centre (UNOSAT),UNOSAT,Other,flooding;geodata,shp,"This map illustrates satellite-detected waters over Tonzang township, Chin Division, Myanmar. UNITAR-UNOSAT analyzed imagery collected by the WorldView-2 satellite on 17 October 2015 to assess the status of a landslide induced dam in Tonzang township. Imagery shows that there has been an increase in the satellite detected waters in the area and a t…"
7a6ab2f6-7122-4956-83c6-f1808ebb86fb,"Gambia, The - Social Development",World Bank Group,World Bank,Creative Commons Attribution International (CC BY),development;hxl;indicators,csv,"Contains data from the World Bank's <a href=""http://data.worldbank.org/"">data portal</a>. There is also a <a href=""https://data.humdata.org/dataset/world-bank-combined-indicators-for-gambia-the"">consolidated country dataset</a> on HDX. Data here cover child labor, gender issues, refugees, and asylum seekers. Children in many countries work long hou…"
1ac02382-a0b5-41fc-8f7e-c273cb334523,Côte d'Ivoire - Roads,OCHA West and Central Africa (ROWCA),Comité National de Télédétection et d'Information Géographique (CNTIG),Other,facilities-infrastructure;geodata;transportation,shp,Réseau routier principal Ces fichiers représentent les principales routes de la Côte d'voire. Ces fichiers ont été mise à jour par le CNTIG.
beb71d8f-7ff6-438f-ac9d-5ad996e3bda4,Nepal - CRS aid data - 2012,OpenNepal (inactive),OpenNepal,Open Database License (ODC-ODbL),funding,csv,The dataset consists of 2478 projects (implemented in Nepal) downloaded from OECD CRS.
5813a591-0fdd-4d8d-8062-ff76701dcf92,Sri Lanka - Population Density,WorldPop,"WorldPop, University of Southampton, UK",Other,baseline population;geodata,geotiff,"<b>WorldPop produces different types of gridded population count datasets, depending on the methods used and end application. Please make sure you have read our <a href=""https://www.worldpop.org/methods/populations"">Mapping Populations</a> overview page before choosing and downloading a dataset.</b> Datasets are available to download in Geotiff and…"
67749f3d-154b-4632-ab36-dcfe41d77596,Djibouti - IFRC Appeals,International Federation of Red Cross and Red Crescent Societies (IFRC),IFRC,Creative Commons Attribution for Intergovernmental Organisations (CC BY-IGO),funding;hxl,csv,"The International Federation of Red Cross and Red Crescent Societies (IFRC) is the world’s largest humanitarian network. Our secretariat supports local Red Cross and Red Crescent action in more than 192 countries, bringing together almost 15 million volunteers for the good of humanity. We launch Emergency Appeals for big and complex disasters affec…"
f7fddb06-32b2-48e3-907d-05aac12aff06,Honduras - Internal Displacements Updates (IDU) (event data),Internal Displacement Monitoring Centre (IDMC),IDMC,Creative Commons Attribution for Intergovernmental Organisations (CC BY-IGO),displacement;internally displaced persons-idp,csv,"<strong>Resource has no data rows!</strong> No conflict and disaster population movement (flows) data recorded for Honduras in the last 180 days. The <strong>IDU (Internal Displacement Updates) dataset</strong>, provided by the <a href=""https://www.internal-displacement.org/"">Internal Displacement Monitoring Centre (IDMC)</a>, offers timely event d…"
b445e24c-2a33-49e4-af11-9c87f19a53fd,Australia - Internal Displacements (New Displacements) – IDPs,Internal Displacement Monitoring Centre (IDMC),IDMC,Creative Commons Attribution for Intergovernmental Organisations (CC BY-IGO),displacement;hxl;internally displaced persons-idp;natural disasters,csv,"The <a href=""http://www.internal-displacement.org/database/displacement-data"">Global Internal Displacement Database (GIDD)</a>, maintained by the <a href=""https://www.internal-displacement.org/"">Internal Displacement Monitoring Centre (IDMC)</a>, provides comprehensive, validated annual estimates of internal displacement worldwide. It defines inter…"
4f53b4b5-8461-4395-8ebc-23f85e3493d4,Bhutan - Financial Sector,World Bank Group,World Bank,Creative Commons Attribution International (CC BY),economics;hxl;indicators,csv,"Contains data from the World Bank's <a href=""http://data.worldbank.org/"">data portal</a>. There is also a <a href=""https://data.humdata.org/dataset/world-bank-combined-indicators-for-bhutan"">consolidated country dataset</a> on HDX. An economy's financial markets are critical to its overall development. Banking systems and stock markets enhance grow…"
