dataset_id,title,organization,dataset_source,license_title,tags,formats,notes_snippet
ceee47a3-cd1d-4eae-ab93-87d6f2ca00b9,Djibouti - Subnational Administrative Boundaries,OCHA Field Information Services Section (FISS),www.gadm.org,Creative Commons Attribution for Intergovernmental Organisations (CC BY-IGO),administrative boundaries-divisions;gazetteer;geodata,geodatabase;shp;xlsx,Djibouti administrative level 0-2 boundaries (COD-AB) dataset. The date that these administrative boundaries were established is unknown. This COD-AB has NOT been reviewed for accuracy and necessary changes in the last 12 months. Sourced from www.gadm.org Vetting by Information Technology Outreach Services (ITOS) with funding from USAID. This COD-A…
5148a1b7-289c-45e1-a5a5-c1b2a9bbd69a,Bahamas - Subnational Population Statistics,UNFPA,WorldPop,Other,baseline population,csv;xls;xlsx,Bahamas administrative level 0 age and sex disaggregated 2022 projected population statistics REFERENCE YEAR 2022
fe024e7c-85fa-4a2d-8e83-b828f9d07583,State of Palestine - Flood Affected Population,OCHA occupied Palestinian territory (oPt),WASH Cluster,Creative Commons Attribution International (CC BY),affected population;climate-weather;flooding,xlsx,"The dataset captures HHs flooded by community in the WB and GZ in the last three years. 8,196 HH affected by floods events in the last three years in Gaza Strip 10,173 affected by flood events in the last three years in the West Bank"
7831c84e-9d9d-4a7a-8469-575bb48b27e2,Central African Republic - Refugees Reintegration Assessment - Individual - 2019-2020,UNHCR - The UN Refugee Agency,UNHCR,Other,protection,pdf;web app,"UNHCR plays a leading role, collaborating with States and other partners, to promote, facilitate, and coordinate voluntary repatriation in safety and dignity. This durable solution of the organization is an end-to-end process including negotiations with the States involved, supporting the transportation of the refugees to a safe location within the…"
153808a6-b404-437b-b9fb-668a6326f7b8,Benin - Food Prices,Food and Agriculture Organization (FAO) of the United Nations,FAOSTAT,Creative Commons Attribution for Intergovernmental Organisations (CC BY-IGO),food security;hxl;indicators,csv,"Food Prices for Benin. Contains data from the FAOSTAT <a href=""https://fenixservices.fao.org/faostat/static/bulkdownloads/datasets_E.json"">bulk data service</a> covering the following categories: Consumer Price Indices, Deflators, Exchange rates, Producer Prices"
54cf80c0-0755-4c9b-af43-8f3e34c3eff3,Community Townwatching (Tamsui District),GeoThings,GeoThings,Creative Commons Attribution International (CC BY),,geojson,"Community Townwatching (Tamsui District) for pre-disaster preparation at December 2nd, 2023"
0c504a86-3660-4c3f-b260-24039e5d0416,Canada - Food Prices,Food and Agriculture Organization (FAO) of the United Nations,FAOSTAT,Creative Commons Attribution for Intergovernmental Organisations (CC BY-IGO),food security;hxl;indicators,csv,"Food Prices for Canada. Contains data from the FAOSTAT <a href=""https://fenixservices.fao.org/faostat/static/bulkdownloads/datasets_E.json"">bulk data service</a> covering the following categories: Consumer Price Indices, Deflators, Exchange rates, Producer Prices"
74f335eb-0f8d-499a-9d95-bc14bbe8905d,Kenya Near Term Projection  FEWS NET Acute Food Insecurity Classifications Geographic Data for 2019,FEWS NET,FEWS NET,Creative Commons Attribution International (CC BY),food security;integrated food security phase classification-ipc,geojson;kml,The FEWS NET Data Warehouse is <strong>currently unavailable</strong>. Datasets on HDX that refer to the Data Warehouse have been archived. Kenya Near Term Projection FEWS NET Acute Food Insecurity Classifications Geographic data for 2019
947c25c6-6499-4e0f-9c67-47e62ee5487f,Andorra - Current IATI Aid Activities,International Aid Transparency Initiative,Various IATI reporting organisations,Other,funding;hxl;who is doing what and where-3w-4w-5w,csv,"List of active aid activities shared via the International Aid Transparency Initiative (IATI). Includes both humanitarian and development activities. More information on each activity (including financial data) is available from <a href=""http://www.d-portal.org"">http://www.d-portal.org</a>"
6353c553-c57b-4d55-803d-7a3f3c2b2302,Germany: Population Density for 400m H3 Hexagons,Kontur,kontur,Creative Commons Attribution International (CC BY),baseline population;geodata;population,geopackage,"Germany population density for 400m H3 hexagons. Built from <a href=""https://data.humdata.org/dataset/kontur-population-dataset"">Kontur Population: Global Population Density for 400m H3 Hexagons</a> Vector H3 hexagons with population counts at 400m resolution. Fixed up fusion of GHSL, Facebook, Microsoft Buildings, Copernicus Global Land Service La…"
190b0052-c043-4edc-b681-2a1433fab1e7,Hungary - Gender,World Bank Group,World Bank,Creative Commons Attribution International (CC BY),gender;hxl;indicators,csv,"Contains data from the World Bank's <a href=""http://data.worldbank.org/"">data portal</a>. There is also a <a href=""https://data.humdata.org/dataset/world-bank-combined-indicators-for-hungary"">consolidated country dataset</a> on HDX. Gender equality is a core development objective in its own right. It is also smart development policy and sound busin…"
4e3887ee-803f-4b73-8e57-248c3e4d2089,"REACH Central African Republic 2022 Multi-Sectoral Needs Assessment (MSNA), Results table",REACH Initiative,REACH Initiative,Creative Commons Attribution International (CC BY),education;food security;health;needs assessment;non-food items-nfi;protection;shelter;water sanitation and hygiene-wash,xlsx,"The 2022 Multi-Sectoral Needs Assessment (MSNA), conducted by the REACH Initiative in close collaboration with the United Nations Office for the Coordination of Humanitarian Affairs (OCHA) and mandated by the Inter-cluster Coordination Group (ICCG), aims to understand the multi-sectoral and sector-specific needs, circumstances, and vulnerabilities …"
d2931c3f-11fb-4a04-9a50-993e00b4b970,Uzbekistan - Education Indicators,UNESCO,UNESCO Institute for Statistics (UIS),Creative Commons Attribution for Intergovernmental Organisations (CC BY-IGO),demographics;education;hxl;indicators;socioeconomics;sustainable development;sustainable development goals-sdg,csv,"Education indicators for Uzbekistan. Contains data from the UNESCO Institute for Statistics <a href=""http://data.uis.unesco.org"">bulk data service</a> covering the following categories: SDG 4 Global and Thematic (made 2025 February), Other Policy Relevant Indicators (made 2025 February), Demographic and Socio-economic (made 2025 February)"
74b18409-efb4-4d61-9351-06db028185dc,"China, Hong Kong Special Administrative Region - Health Indicators",World Health Organization,World Health Organization,Other,disability;disease;environment;health;hxl;indicators;maternity;women,csv,"This dataset contains data from WHO's <a href=""https://www.who.int/gho/en/"">data portal</a> covering the following categories: Air pollution, Antimicrobial resistance (AMR), Assistive technology, Child mortality, Dementia diagnosis, treatment and care, Dementia policy and legislation, Environment and health, Foodborne Diseases Estimates, Global Dem…"
4ec1d03c-6c2c-41b8-845e-135e0ea4ccd7,Libya - VIEWS conflict forecasts,Violence & Impacts Early-Warning System,Violence & Impacts Early-Warning System,Creative Commons Attribution Share-Alike (CC BY-SA),conflict-violence;fatalities;forecasting;hxl,csv,The Violence &amp; Impacts Early-Warning System (VIEWS) is an award-winning conflict prediction system that generates monthly forecasts for violent conflicts across the world up to three years in advance. It is supported by the iterative research and development activities undertaken by the VIEWS consortium.
f3731da6-4772-42fc-b656-53c343c27d5a,Mozambique - HungerMap data,WFP - World Food Programme,WFP HungerMap,Creative Commons Attribution Share-Alike (CC BY-SA),food security;hxl;indicators,csv,"HungerMapLIVE is the World Food Programme (WFP)’s global hunger monitoring system. It combines key metrics from various data sources – such as food security information, weather, population size, conflict, hazards, nutrition information and macro-economic data – to help assess, monitor and predict the magnitude and severity of hunger in near real-t…"
b9265db1-88a2-4dd0-99b5-778d02116ebc,Dominican Republic: Flood - 47475.0 sq m - Nov 2023,WFP Advanced Disaster Analysis & Mapping,WFP ADAM,Creative Commons Attribution Share-Alike (CC BY-SA),flooding;geodata,geojson;geopackage;geotiff;txt,<strong>ADAM ID: FL-20231120-DOM-00</strong> Flood covering 47475.0 sq m on Nov 20 2023 in Dominican Republic. It impacted 349525 people.
92278420-6cdb-4e7c-9c6c-ff5614a05573,UNOSAT - FAO Gaza Strip Cropland Damage Assessment - August 2024,United Nations Satellite Centre (UNOSAT),UN Operational Satellite Applications Programme (UNOSAT),Creative Commons Attribution Share-Alike (CC BY-SA),complex emergency-conflict-security;crisis-opt-israel-hostilities;geodata,geodatabase,"<strong>UNOSAT code: CE20231007PSE</strong> This map illustrates satellite-detected changes in cropland areas of the Gaza Strip resulting from the decline in the health and density of crops due to the ongoing conflict. UNOSAT conducted an analysis utilising satellite imagery collected by the Sentinel-2 satellite between August 2017 and 2024, perfor…"
eed8a318-d3a2-457c-b930-eb2a2a850a56,Turkmenistan - Infrastructure,World Bank Group,World Bank,Creative Commons Attribution International (CC BY),facilities-infrastructure;hxl;indicators,csv,"Contains data from the World Bank's <a href=""http://data.worldbank.org/"">data portal</a>. There is also a <a href=""https://data.humdata.org/dataset/world-bank-combined-indicators-for-turkmenistan"">consolidated country dataset</a> on HDX. Infrastructure helps determine the success of manufacturing and agricultural activities. Investments in water, s…"
a9cc0c73-f5b3-46b5-b79a-740770f766c5,Senegal - Nutrition,OCHA West and Central Africa (ROWCA),"UNICEF, 2011",Other,nutrition,xlsx,Global acute malnutrition in Senegal. The Excel file shows the prevalence of Global Acute Malnutrition (GAM) in Senegal in 2011.
350760a0-ab2e-4da1-8951-0f764e6d612b,Haiti - Age and Gender Structures (2015-2030),WorldPop,Multiple sources,Other,baseline population;demographics;gender and age disaggregated data-gadd;geodata,geotiff,"Estimates of total number of people per grid square broken down by gender and age groupings (including 0-1 and by 5-year up to 90+) for Haiti, R2025A version v1. The dataset is available to download in Geotiff format at a resolution of 3 arc (approximately 100m at the equator). The projection is Geographic Coordinate System, WGS84. The units are es…"
624c70ea-8d15-47f8-a6ed-74207e27ed51,Colombia - PiN Cluster Salud,3iS,Humanitarian partners,Public Domain / No restrictions (CC0),health;people in need-pin,xlsx,"Esta base contiene el resultado final del cálculo de las severidades, la Población en Necesidad (PiN) y las desagregaciones poblacionales para el Clúster de Salud, Colombia 2025."
33b49c18-27b9-464b-9554-2042a67ff83c,Netherlands (Kingdom of the) - Spatial Distribution of Population (2015-2030),WorldPop,Multiple sources,Other,baseline population;geodata,geotiff,"Estimates, total number of people per grid-cell. The dataset is available to download in Geotiff format at a resolution of 3 arc (approximately 100m at the equator). The projection is Geographic Coordinate System, WGS84. The units are number of people per pixel. The mapping approach is Random Forest-based dasymetric redistribution. More information…"
5b67cc82-ef3e-4a9d-a255-b415d0baf7ea,Cabo Verde - Gender,World Bank Group,World Bank,Creative Commons Attribution International (CC BY),gender;hxl;indicators,csv,"Contains data from the World Bank's <a href=""http://data.worldbank.org/"">data portal</a>. There is also a <a href=""https://data.humdata.org/dataset/world-bank-combined-indicators-for-cabo-verde"">consolidated country dataset</a> on HDX. Gender equality is a core development objective in its own right. It is also smart development policy and sound bu…"
d07b3bac-7987-4cbe-92ce-765cbdcc76b1,"Netherlands - Demographic, Health, Education and Transport indicators","United Nations Human Settlements Programmes, Data and Analytics Section",UNHABITAT,Creative Commons Attribution for Intergovernmental Organisations (CC BY-IGO),baseline population;education;health;hxl;indicators;transportation,csv,"The urban indicators data available here are analyzed, compiled and published by UN-Habitat’s Global Urban Observatory which supports governments, local authorities and civil society organizations to develop urban indicators, data and statistics. Urban statistics are collected through household surveys and censuses conducted by national statistics …"
c8431636-ef67-4636-9d75-cc756f30b75a,Albania - Population Density,WorldPop,"WorldPop, University of Southampton, UK",Other,baseline population;geodata,geotiff,"<b>WorldPop produces different types of gridded population count datasets, depending on the methods used and end application. Please make sure you have read our <a href=""https://www.worldpop.org/methods/populations"">Mapping Populations</a> overview page before choosing and downloading a dataset.</b> Datasets are available to download in Geotiff and…"
61779f3b-5cfd-44b7-91d8-ad7ce97f6f56,Indicadores WASH de extranjeros en Colombia - Censo 2018,iMMAP Inc.,iMMAP,Creative Commons Attribution International (CC BY),baseline population;demographics;hxl;water sanitation and hygiene-wash,xlsx,Indicadores WASH de la población extranjera en Colombia por municipio según el Censo Nacional de Población y Vivienda de 2018
d91f5a96-1543-4a02-9340-298a14af62b3,Turkiye - Trade,World Bank Group,World Bank,Creative Commons Attribution International (CC BY),hxl;indicators;trade,csv,"Contains data from the World Bank's <a href=""http://data.worldbank.org/"">data portal</a>. There is also a <a href=""https://data.humdata.org/dataset/world-bank-combined-indicators-for-turkiye"">consolidated country dataset</a> on HDX. Trade is a key means to fight poverty and achieve the Millennium Development Goals, specifically by improving develop…"
9e9ed7b7-bff1-42f2-a246-fc028498b26f,Sierra Leone Medium Term Projection  FEWS NET Acute Food Insecurity Classifications Geographic Data for 2016,FEWS NET,FEWS NET,Creative Commons Attribution International (CC BY),food security;integrated food security phase classification-ipc,geojson,The FEWS NET Data Warehouse is <strong>currently unavailable</strong>. Datasets on HDX that refer to the Data Warehouse have been archived. Sierra Leone Medium Term Projection FEWS NET Acute Food Insecurity Classifications Geographic data for 2016
d8cfed34-2b2c-41b4-8ed9-1a018bae1a75,Cameroon Current Situation FEWS NET Acute Food Insecurity Classifications Geographic Data for 2022,FEWS NET,FEWS NET,Creative Commons Attribution International (CC BY),food security;integrated food security phase classification-ipc,geojson;kml,Cameroon Current Situation FEWS NET Acute Food Insecurity Classifications Geographic data for 2022
93c5f090-e18a-4780-8ccc-1aa35b608baf,Niger - Health,World Bank Group,World Bank,Creative Commons Attribution International (CC BY),health;hxl;indicators,csv,"Contains data from the World Bank's <a href=""http://data.worldbank.org/"">data portal</a>. There is also a <a href=""https://data.humdata.org/dataset/world-bank-combined-indicators-for-niger"">consolidated country dataset</a> on HDX. Improving health is central to the Millennium Development Goals, and the public sector is the main provider of health c…"
85bc89f5-549e-4d81-89b4-84448d7b619c,Turkiye - Private Sector,World Bank Group,World Bank,Creative Commons Attribution International (CC BY),economics;hxl;indicators,csv,"Contains data from the World Bank's <a href=""http://data.worldbank.org/"">data portal</a>. There is also a <a href=""https://data.humdata.org/dataset/world-bank-combined-indicators-for-turkiye"">consolidated country dataset</a> on HDX. Private markets drive economic growth, tapping initiative and investment to create productive jobs and raise incomes.…"
5134b1de-1ee1-49e3-b886-8cce724983f1,Turkiye - Education,World Bank Group,World Bank,Creative Commons Attribution International (CC BY),education;hxl;indicators,csv,"Contains data from the World Bank's <a href=""http://data.worldbank.org/"">data portal</a>. There is also a <a href=""https://data.humdata.org/dataset/world-bank-combined-indicators-for-turkiye"">consolidated country dataset</a> on HDX. Education is one of the most powerful instruments for reducing poverty and inequality and lays a foundation for susta…"
3346bfff-aa0b-49df-a5d4-eaf8ba53a351,Satellite detected water extents between the 13th and the 17th November 2020 in El Salvador,United Nations Satellite Centre (UNOSAT),UN Operational Satellite Applications Programme (UNOSAT),Creative Commons Attribution Share-Alike (CC BY-SA),cyclones-hurricanes-typhoons;geodata,geodatabase;shp,"<strong>UNOSAT code: TC20201118SLV</strong> This map illustrates satellite-detected surface waters (cumulative) in El Salvador as detected by VIIRS-NOAA satellite between 13th &amp; 17th November 2020. Within the analyzed area of about 20,000 km2, a total of about 440 km2 of lands appear to be flooded. Based on HRSL population data and the detected…"
bd34aaf5-e3b2-4ed8-bc92-613ed0a3c54b,Chad - Population Density,WorldPop,"WorldPop, University of Southampton, UK",Other,baseline population;geodata,geotiff,"<b>WorldPop produces different types of gridded population count datasets, depending on the methods used and end application. Please make sure you have read our <a href=""https://www.worldpop.org/methods/populations"">Mapping Populations</a> overview page before choosing and downloading a dataset.</b> Datasets are available to download in Geotiff and…"
b6f8479e-d386-4133-9602-4e6fbdf93cfe,"Uganda - Post-Distribution Monitoring of Non-Food Items - Soap, 2020",UNHCR - The UN Refugee Agency,UNHCR,Other,health;needs assessment;water sanitation and hygiene-wash,pdf;web app,"UNHCR uses Post Distribution Monitoring (PDM) as a mechanism to collect refugees' feedback on the quality, sufficiency, utilization and effectiveness of the assistance items they receive. The underlying principle behind the process is linked to accountability, as well as a commitment to improve the quality and relevance of support provided, and rel…"
21f640cc-3eb3-4400-97cc-1b8ba9ec089c,"Nepal: CFP Protection, Reconstruction and Food Security and Livelihood 2018 surveys",Inter Agency Common Feedback Project Nepal  (inactive),Inter Agency Common Feedback Project Nepal (CFP),Creative Commons Attribution International (CC BY),earthquake-tsunami;hxl,csv,This data is the collection of perception of people affected by earthquake in Nepal. The data is collected in 14 district of Nepal which has more than sixty percent of damage level by earthquake in 2015. The total of 2100 people are surveyed in various VDC of the district.
11eb7081-cffa-44ef-9cf8-31ca0a547828,"Algeria - Demographic, Health, Education and Transport indicators","United Nations Human Settlements Programmes, Data and Analytics Section",UNHABITAT,Creative Commons Attribution for Intergovernmental Organisations (CC BY-IGO),baseline population;education;health;hxl;indicators;transportation,csv,"The urban indicators data available here are analyzed, compiled and published by UN-Habitat’s Global Urban Observatory which supports governments, local authorities and civil society organizations to develop urban indicators, data and statistics. Urban statistics are collected through household surveys and censuses conducted by national statistics …"
289d6875-57f8-46f9-9506-25a5bcf5534d,Afghanistan - Current IATI Aid Activities,International Aid Transparency Initiative,Various IATI reporting organisations,Other,funding;hxl;who is doing what and where-3w-4w-5w,csv,"List of active aid activities shared via the International Aid Transparency Initiative (IATI). Includes both humanitarian and development activities. More information on each activity (including financial data) is available from <a href=""http://www.d-portal.org"">http://www.d-portal.org</a>"
389e4855-da34-4498-986b-82298f1aec60,Vanuatu: Earthquake - 6.5M - Aug 2023,WFP Advanced Disaster Analysis & Mapping,WFP ADAM,Creative Commons Attribution Share-Alike (CC BY-SA),affected population;earthquake-tsunami,csv,<strong>ADAM ID: eq_us7000knq0</strong> Magnitude 6.5 earthquake at 192.955 depth occurred on Aug 16 2023 in 33km W of Vétuboso. It impacted 3825 people. The epicentre was at latitude -13.8814 longitude 167.1582.
e90e7fd6-b0b8-4698-8350-cef4b2d09be8,Semester 1 VAS Coverage (January to June),UNICEF Data and Analytics (HQ),"The indicator data draw on inter-agency estimates and nationally representative household surveys such as Multiple Indicator Cluster Surveys (MICS) and Demographic and Health Surveys (DHS). In addition, data from administrative sources and other United Nations organizations have been used. More detailed information on the data sources is provided at https://data.unicef.org/.",CC BY 3.0 IGO,children;indicators;nutrition,csv;xml,Percentage of children 6–59 months of age who received an age appropriate dose of vitamin A in semester 1 through the main distribution mechanism
3b3723db-7a28-45c9-9c1a-df9258f7fe47,Barbados - Private Sector,World Bank Group,World Bank,Creative Commons Attribution International (CC BY),economics;hxl;indicators,csv,"Contains data from the World Bank's <a href=""http://data.worldbank.org/"">data portal</a>. There is also a <a href=""https://data.humdata.org/dataset/world-bank-combined-indicators-for-barbados"">consolidated country dataset</a> on HDX. Private markets drive economic growth, tapping initiative and investment to create productive jobs and raise incomes…"
fc9e5f9c-62aa-47b8-a242-6e6a13ccc7fb,Mozambique Current Situation FEWS NET Acute Food Insecurity Classifications Geographic Data for 2012,FEWS NET,FEWS NET,Creative Commons Attribution International (CC BY),food security;integrated food security phase classification-ipc,geojson;kml,The FEWS NET Data Warehouse is <strong>currently unavailable</strong>. Datasets on HDX that refer to the Data Warehouse have been archived. Mozambique Current Situation FEWS NET Acute Food Insecurity Classifications Geographic data for 2012
9bfe94e7-82fe-4fdd-b955-d3c26b10df8e,Iraq - Spatial Distribution of Population (2015-2030),WorldPop,Multiple sources,Other,baseline population;geodata,geotiff,"Estimates, total number of people per grid-cell. The dataset is available to download in Geotiff format at a resolution of 3 arc (approximately 100m at the equator). The projection is Geographic Coordinate System, WGS84. The units are number of people per pixel. The mapping approach is Random Forest-based dasymetric redistribution. More information…"
dda4ed1f-2bb3-4c1c-b0b0-4e57399fe006,Togo - Age and gender structures,WorldPop,"WorldPop, University of Southampton, UK",Other,baseline population;demographics;geodata,geotiff,"<b>WorldPop produces different types of gridded population count datasets, depending on the methods used and end application. Please make sure you have read our <a href=""/methods/populations"">Mapping Populations</a> overview page before choosing and downloading a dataset.</b> A description of the modelling methods used for age and gender structures…"
17fb216b-6a19-4ba2-8e46-52fe73ae89a0,Chile: Cases of crimes by public raw in Santiago de Chile,Hub Latin America,"Instituto Milenio Fundamentos de los Datos – IMFD and U.S Department of State Contributor	Hub Latin America Date of Dataset	January 01, 2018-December 31, 2020 Updated	12 October 2021 Expected Update Frequency	Every year Location	 Chile Visibility	 Public - make it private License	Creative Commons Attribution Share-Alike Methodology	Registry Caveats / Comments	 Created by Crime Studies and Analysis Center  Tags	CRIME File Format	 SHP",Creative Commons Attribution Share-Alike (CC BY-SA),conflict-violence,shp,This data is about public raw crimes (2018-2020) recopiled by CEAD-SPD
8e044770-d6b2-4938-8ca6-a115b8ed771d,Tunisia: WOF Administrative Subdivisions and Human Settlements,Who's On First,Multiple sources,Creative Commons Attribution International (CC BY),administrative boundaries-divisions;geodata;populated places-settlements;population,shp,"This dataset contains administrative polygons grouped by country (admin-0) with the following subdivisions according to Who's On First placetypes: - macroregion (admin-1 including region) - region (admin-2 including state, province, department, governorate) - macrocounty (admin-3 including arrondissement) - county (admin-4 including prefecture, sub…"
8cd951b7-d03d-4bda-854a-866ed1e09f2d,Indonesia - Trade,World Bank Group,World Bank,Creative Commons Attribution International (CC BY),hxl;indicators;trade,csv,"Contains data from the World Bank's <a href=""http://data.worldbank.org/"">data portal</a>. There is also a <a href=""https://data.humdata.org/dataset/world-bank-combined-indicators-for-indonesia"">consolidated country dataset</a> on HDX. Trade is a key means to fight poverty and achieve the Millennium Development Goals, specifically by improving devel…"
