dataset_id,title,organization,dataset_source,license_title,tags,formats,notes_snippet
5b40f5f6-a381-4631-95ba-9c20ee9c6d79,Dominican Republic - Age and gender structures,WorldPop,"WorldPop, University of Southampton, UK",Other,baseline population;demographics;geodata,geotiff,"<b>WorldPop produces different types of gridded population count datasets, depending on the methods used and end application. Please make sure you have read our <a href=""/methods/populations"">Mapping Populations</a> overview page before choosing and downloading a dataset.</b> A description of the modelling methods used for age and gender structures…"
d7018eba-acdb-49e1-a565-2eb0cb180e5d,Aruba - Energy and Mining,World Bank Group,World Bank,Creative Commons Attribution International (CC BY),development;energy;hxl;indicators,csv,"Contains data from the World Bank's <a href=""http://data.worldbank.org/"">data portal</a>. There is also a <a href=""https://data.humdata.org/dataset/world-bank-combined-indicators-for-aruba"">consolidated country dataset</a> on HDX. The world economy needs ever-increasing amounts of energy to sustain economic growth, raise living standards, and reduc…"
dce2c3e6-1cbb-4361-8875-b43995fbdf44,"Somalia - Water Price Monitoring , August 2017",REACH Initiative,REACH Initiative,Public Domain / No restrictions (CC0),indicators;markets;water sanitation and hygiene-wash,xlsx,"This data presents the findings from the August water price monitoring in Bay, Gedo, Lower Juba, Middle Shabelle and Nugaal regions. Data is collected through a monthly Key Informant questionnaire with water point administrators."
0f364cf4-70d7-4203-b2da-e9a4ddc2f395,Kazakhstan - Energy and Mining,World Bank Group,World Bank,Creative Commons Attribution International (CC BY),development;energy;hxl;indicators,csv,"Contains data from the World Bank's <a href=""http://data.worldbank.org/"">data portal</a>. There is also a <a href=""https://data.humdata.org/dataset/world-bank-combined-indicators-for-kazakhstan"">consolidated country dataset</a> on HDX. The world economy needs ever-increasing amounts of energy to sustain economic growth, raise living standards, and …"
e5d49f31-802d-4917-a9a3-d1a51ff02918,"Accumulated satellite-detected water extents in Gaborone, South East and Kgatleng Districts, Botswana as of 4 March 2025",United Nations Satellite Centre (UNOSAT),UN Operational Satellite Applications Programme (UNOSAT),Creative Commons Attribution Share-Alike (CC BY-SA),flooding;geodata,geodatabase;shp,"<strong>UNOSAT code: FL20250220BWA, GDACS ID: 1103128</strong> Satellite detected water extents in Gaborone, South East and Kgatleng Districts, Botswana as of 4 March 2025 This map illustrates the satellite-detected accumulated flood extent in Gaborone, South East District, Botswana, as observed from multisatellite imagery, including Sentinel-2, Pl…"
1ee57ddd-5ad6-4c90-9826-7e1ea6479ab5,"Syrian Arab Republic - Housing, slums and informal settlements","United Nations Human Settlements Programmes, Data and Analytics Section",UNHabitat,Open Data Commons Public Domain Dedication and License (PDDL),sustainable development goals-sdg;urban,csv;xlsx,"Proportion of urban population living in slums or informal settlements per country, territory and region, based on 4 out of 5 main household shelter deprivations defined by UN-Habitat as indicators of informality: lack of access to improved water, lack of access to improved sanitation, lack of sufficient living area and quality/durability of struct…"
9acebadf-25c1-429c-8007-47270fc73b74,Colombia - Environment,World Bank Group,World Bank,Creative Commons Attribution International (CC BY),environment;hxl;indicators,csv,"Contains data from the World Bank's <a href=""http://data.worldbank.org/"">data portal</a>. There is also a <a href=""https://data.humdata.org/dataset/world-bank-combined-indicators-for-colombia"">consolidated country dataset</a> on HDX. Natural and man-made environmental resources – fresh water, clean air, forests, grasslands, marine resources, and ag…"
f40c6491-187c-4016-9f1a-719ef37cd416,2018 Tropical Cyclone Sagar Path,IGAD Climate Prediction and Applications Center (ICPAC),ICPAC,Creative Commons Attribution International (CC BY),geodata;hazards and risk,csv;geojson;shp;xlsx,"This layer shows the movement path of 2018 Tropical Cyclone Sagar. Cyclone Sagar made landfall in north-western Somaliland on 19 May, 2018. It was a very rare cyclone in the Gulf of Aden. The storm moved with wind gusts of up to 120 km/hour that delivered a year&rsquo;s worth of rain to some areas, that is between 150 and 200mm in some parts of the…"
d8d471e7-80e1-4194-9232-b635db831d7b,Namibia - Historical Health Indicators,World Health Organization,World Health Organization,Other,hxl;indicators,csv,"This dataset contains historical data from WHO's <a href=""https://www.who.int/gho/en/"">data portal</a>."
d1d0c217-8c6b-4747-ab1e-1069e2ff3e6b,Nepal travel distance between cities (km),HDX,UN Resident Coordinator/Humanitarian Coordinator's Office,Other,earthquake-tsunami;roads;transportation,csv,"A table depicting travel times between various cities in kilometers. Data taken from <a href=""http://un.org.np/sites/default/files/2011-11-15-Nepal_Road_Distance_A3_22Aug2011.pdf"">this map</a>. Distance data from Department of Road, Road Statistics, 2005,(DoR)MoPPW/GoN"
c20fd858-5fc7-4717-9727-b0c55b451bc9,Trinidad and Tobago - Private Sector,World Bank Group,World Bank,Creative Commons Attribution International (CC BY),economics;hxl;indicators,csv,"Contains data from the World Bank's <a href=""http://data.worldbank.org/"">data portal</a>. There is also a <a href=""https://data.humdata.org/dataset/world-bank-combined-indicators-for-trinidad-and-tobago"">consolidated country dataset</a> on HDX. Private markets drive economic growth, tapping initiative and investment to create productive jobs and ra…"
75483c27-d696-471a-ba26-e584d71d0fa7,Timor-Leste - Data on forcibly displaced populations and stateless persons,UNHCR - The UN Refugee Agency,UNHCR,Creative Commons Attribution for Intergovernmental Organisations (CC BY-IGO),asylum seekers;hxl;internally displaced persons-idp;population;refugees;stateless persons,csv,"Data collated by UNHCR, containing information about forcibly displaced populations and stateless persons, spanning across more than 70 years of statistical activities. The data includes the countries / territories of asylum and origin. Specific resources are available for end-year population totals, demographics, asylum applications, decisions, an…"
60bc5194-3625-46b7-9bc1-d017d6468995,Share of urban population,UNICEF Data and Analytics (HQ),"The indicator data draw on inter-agency estimates and nationally representative household surveys such as Multiple Indicator Cluster Surveys (MICS) and Demographic and Health Surveys (DHS). In addition, data from administrative sources and other United Nations organizations have been used. More detailed information on the data sources is provided at https://data.unicef.org/.",CC BY 3.0 IGO,children;demographics;indicators;urban,csv;xml,Urban population as a percentage of the total population
4b966910-1cc3-4517-9053-830dc7e96e67,Ukraine : Enrollment in Early Childhood Educator Support Courses,Childhood Education International (inactive),Childhood Education International,Creative Commons Attribution International (CC BY),children;education,xlsx,"The data set provides the number of participants enrolled in four free online courses as of February 13, 2024. The courses are designed to support early childhood educators, primary school teachers, and practical psychologists in Ukraine."
f85068c5-8594-4809-ab21-46ca7f796951,Austria - Climate Change,World Bank Group,World Bank,Creative Commons Attribution International (CC BY),climate-weather;hxl;indicators,csv,"Contains data from the World Bank's <a href=""http://data.worldbank.org/"">data portal</a>. There is also a <a href=""https://data.humdata.org/dataset/world-bank-combined-indicators-for-austria"">consolidated country dataset</a> on HDX. Climate change is expected to hit developing countries the hardest. Its effects—higher temperatures, changes in preci…"
74830d96-f175-4532-8046-ad731220a42b,Chad Near Term Projection  FEWS NET Acute Food Insecurity Classifications Geographic Data for 2021,FEWS NET,FEWS NET,Creative Commons Attribution International (CC BY),food security;integrated food security phase classification-ipc,geojson;kml,Chad Near Term Projection FEWS NET Acute Food Insecurity Classifications Geographic data for 2021
5850da31-31f6-439e-8561-96e1ae0ad336,Turkmenistan - Historical Health Indicators,World Health Organization,World Health Organization,Other,hxl;indicators,csv,"This dataset contains historical data from WHO's <a href=""https://www.who.int/gho/en/"">data portal</a>."
629744bd-44a6-4111-bf6b-9337a4a2a79c,French Guiana: Rainfall Indicators at Subnational Level,WFP - World Food Programme,Climate Hazards Center UC Santa Barbara & WFP,Creative Commons Attribution International (CC BY),climate-weather;environment,csv,"This dataset contains dekadal rainfall indicators, computed from Climate Hazards Group InfraRed Precipitation satellite imagery with insitu Station data (CHIRPS) version 2 and the CHIRPS-GEFS short term rainfall forecasts, aggregated by subnational administrative units. Included indicators are (for each dekad): <ul> <li>10 day rainfall [mm] (<code>…"
922c1714-a293-4130-bf40-246cb7ec7b22,Evolution of Malian refugees since September 2012,OCHA Mali,UNHCR,Creative Commons Attribution for Intergovernmental Organisations (CC BY-IGO),conflict-violence;population;refugees,csv;xlsx,"This excel spreadsheet compiles the data of the number of malian refugees in Mauritania, Niger and Burkina Faso from September 2012 - December 2014. The data source is UNHCR's data portal for the Sahel: http://data.unhcr.org/SahelSituation/country.php?id=501"
3066c945-ed6e-4903-8080-7943d41f634f,"Afghanistan: Integrated Context Analysis (ICA), 2016",WFP - World Food Programme,World Food Programme,Open Database License (ODC-ODbL),geodata;hazards and risk,pdf;png;shp;xlsx,<code>The ICA is a process of consultations supported by mapped-out data that produces a strategic plan describing where different combinations of programme themes are appropriate to achieve goals of reducing food insecurity and climate related shock risk. </code> The ICA combines multi-year food security trends with natural shock risk data to high…
efe2141f-0864-422f-b111-b52dc89f888b,"DJIBOUTI - Education indicators, UNECA",United Nations Economic Commission for Africa,UNECA,Creative Commons Attribution for Intergovernmental Organisations (CC BY-IGO),education;indicators,csv,"This dataset contains many indicators in education such as as Net enrolment rate in primary education, Ratio of girls to boys in primary education, etc. The whole list and their description can be find in this link https://bit.ly/2NWP6Z1"
6f2c7f0f-9d0f-4e4f-987b-d8cfceeb472a,Malta - External Debt,World Bank Group,World Bank,Creative Commons Attribution International (CC BY),economics;hxl;indicators,csv,"Contains data from the World Bank's <a href=""http://data.worldbank.org/"">data portal</a>. There is also a <a href=""https://data.humdata.org/dataset/world-bank-combined-indicators-for-malta"">consolidated country dataset</a> on HDX. Debt statistics provide a detailed picture of debt stocks and flows of developing countries. Data presented as part of …"
a9395169-2e92-4de2-b182-b8eeb8921577,Iraq -  Displacement Tracking Matrix (DTM) 14 Sept 2014,OCHA Iraq (inactive),IOM Iraq ,Other,displacement;geodata;internally displaced persons-idp;populated places-settlements;refugees,shp,"IOM IRAQ Displacement Tracking Matrix (DTM) 14 September 2014 For the time period January to September 2014 the DTM identified 1,725,432 internally displaced individuals dispersed across 1,715 distinct locations in Iraq. HCT projected estimates state that approximately 1.8 million individuals have been displaced nationwide through 2014."
753a680d-4628-4b2f-9a5f-7c1c54c00bd8,"Venezuela, RB - Economy and Growth",World Bank Group,World Bank,Creative Commons Attribution International (CC BY),economics;hxl;indicators,csv,"Contains data from the World Bank's <a href=""http://data.worldbank.org/"">data portal</a>. There is also a <a href=""https://data.humdata.org/dataset/world-bank-combined-indicators-for-venezuela-rb"">consolidated country dataset</a> on HDX. Economic growth is central to economic development. When national income grows, real people benefit. While there…"
1b6cbbff-036a-43d9-8d6a-a1f0ad41605b,Japan - Economy and Growth,World Bank Group,World Bank,Creative Commons Attribution International (CC BY),economics;hxl;indicators,csv,"Contains data from the World Bank's <a href=""http://data.worldbank.org/"">data portal</a>. There is also a <a href=""https://data.humdata.org/dataset/world-bank-combined-indicators-for-japan"">consolidated country dataset</a> on HDX. Economic growth is central to economic development. When national income grows, real people benefit. While there is no …"
03b9f03b-9be5-47c5-a93c-c23485b1b2dc,Somalia Regions hit by 1984 Tropical Cyclone 1A,IGAD Climate Prediction and Applications Center (ICPAC),ICPAC,Creative Commons Attribution International (CC BY),geodata;hazards and risk,csv;geojson;shp;xlsx,"This was the first documented tropical cyclone to move through the Gulf of Aden.In May 28,1984 TC1A storm struck about 65Km (40 miles) west of Berbera, Somalia and quickly dissipated. The storm had maximum wind speeds of 23m/s before dissipating. This layer shows the occurence of the tropical cyclone in Woqooyi Galbeed province, Somalia. 1984 TC 1A…"
a98aca08-3e9f-4108-82d2-53e7df37742c,South Sudan: Humanitarian needs overview,HDX,OCHA South Sudan,Creative Commons Attribution International (CC BY),hxl;people in need-pin,xlsx,South Sudan Humanitarian needs overview for 2021. This data has been extracted from the published HNO document for South Sudan
e68dd97e-08df-4973-a931-ab3a33170b26,Mali: JIAF Humanitarian Needs People in Need and Severity,OCHA Mali,Humanitarian partners,Creative Commons Attribution International (CC BY),affected area;affected population;humanitarian needs overview-hno;humanitarian response plan-hrp;hxl;people in need-pin;severity,csv;pdf;xlsx,"This dataset contains the overall people in need and intersectoral severity by disaggregation level which Includes administrative divisions and population groups, depending on each country's decision. The dataset is produced by the United Nations for the Coordination of Humanitarian Affairs (OCHA) in collaboration with humanitarian partners using t…"
d0f79f0e-d9c9-449e-ae57-06d281a42f8f,New Caledonia - Internal Displacements (New Displacements) – IDPs,Internal Displacement Monitoring Centre (IDMC),IDMC,Creative Commons Attribution for Intergovernmental Organisations (CC BY-IGO),conflict-violence;displacement;hxl;internally displaced persons-idp;natural disasters,csv,"The <a href=""http://www.internal-displacement.org/database/displacement-data"">Global Internal Displacement Database (GIDD)</a>, maintained by the <a href=""https://www.internal-displacement.org/"">Internal Displacement Monitoring Centre (IDMC)</a>, provides comprehensive, validated annual estimates of internal displacement worldwide. It defines inter…"
25704cd2-7c53-4692-9239-a6ec7e620e4c,"Satellite detected water extent as of 18 July 2020 over Mymensingh, Rajshahi and Rangpur Divisions, Bangladesh",United Nations Satellite Centre (UNOSAT),UN Operational Satellite Applications Programme (UNOSAT),Creative Commons Attribution Share-Alike (CC BY-SA),flooding;geodata,geodatabase;shp,"<strong>UNOSAT code: FL20200713BGD</strong> This map illustrates satellite-detected surface waters over Mymensingh, Rajshahi and Rangpur Division of Bangladesh as observed from a TerraSAR-X image acquired on 18 July 2020. Within the analyzed area of about 9,000 km2, a total of about 2,860 km2 of lands appear to be flooded. This is a preliminary ana…"
1bb419a0-2a9f-44de-ac4b-657a3d5e2dd8,Greece - Energy and Mining,World Bank Group,World Bank,Creative Commons Attribution International (CC BY),development;energy;hxl;indicators,csv,"Contains data from the World Bank's <a href=""http://data.worldbank.org/"">data portal</a>. There is also a <a href=""https://data.humdata.org/dataset/world-bank-combined-indicators-for-greece"">consolidated country dataset</a> on HDX. The world economy needs ever-increasing amounts of energy to sustain economic growth, raise living standards, and redu…"
c7cfb6cf-0a3e-4fd9-b065-e2ad039fc65b,Taiwan (Province of China) - Births,WorldPop,"WorldPop, University of Southampton, UK",Other,births;geodata,geotiff,"The health and survival of women and their new-born babies in low income countries is a key public health priority, but basic and consistent subnational data on the number of live births to support decision making has been lacking. WorldPop integrates small area data on the distribution of women of childbearing age and age-specific fertility rates …"
4ef9abd7-5ca7-4bb2-b1c9-af2c41a0a65e,"Eaux de surface détectées par satellite entre le 24 novembre et le 05 décembre 2022 dans la province de Tshopo, République Démocratique du Congo",United Nations Satellite Centre (UNOSAT),UN Operational Satellite Applications Programme (UNOSAT),Creative Commons Attribution Share-Alike (CC BY-SA),flooding;geodata,geodatabase;shp;xlsx,"<strong>UNOSAT code FL20221125COD</strong> Cette carte illustre l'étendue des eaux de surface détectées par satellite en utilisant de l'imagerie satellite VIIRS dans la province de Tshopo (République Démocratique du Congo) entre le 24 novembre et le 05 décembre 2022. Dans la zone analysée d'environ 200 000 km², un total d'environ 1 600 km² de terre…"
bbcd2c17-8eb8-4ca3-a98e-9f91ce5ed2b0,Airports in the French Southern Territories,OurAirports,OurAirports.com community web site.,Public Domain / No restrictions (CC0),aviation;geodata;hxl;transportation,csv,"List of airports in the French Southern Territories, with latitude and longitude. Unverified community data from ourairports.com."
310f00f6-5922-4216-a023-f0bf4c8bb48e,AFD Development Assistance,Agence Française de Developpement (AFD) (inactive)," Agence Française de Développement,  AFD",Creative Commons Attribution for Intergovernmental Organisations (CC BY-IGO),funding,json,"Development assistance data from <a href=""http://opendata.afd.fr"">AFD - French Development Agency</a> The dataset covers French development assistance, on ongoing projects in 2015. The data are disclose as receivers agreed France to share it. AFD aims at updating the data every trimester to take into account the flow of new project being funded. Cu…"
810800f7-ca2d-49ea-b845-6c20e7588e72,Côte d'Ivoire: Rainfall Indicators at Subnational Level,WFP - World Food Programme,Climate Hazards Center UC Santa Barbara & WFP,Creative Commons Attribution International (CC BY),climate-weather;environment,csv,"This dataset contains dekadal rainfall indicators, computed from Climate Hazards Group InfraRed Precipitation satellite imagery with insitu Station data (CHIRPS) version 2 and the CHIRPS-GEFS short term rainfall forecasts, aggregated by subnational administrative units. Included indicators are (for each dekad): <ul> <li>10 day rainfall [mm] (<code>…"
1a15b4d3-4d62-4a19-a586-0479f32b088c,Croatia - Climate Change,World Bank Group,World Bank,Creative Commons Attribution International (CC BY),climate-weather;hxl;indicators,csv,"Contains data from the World Bank's <a href=""http://data.worldbank.org/"">data portal</a>. There is also a <a href=""https://data.humdata.org/dataset/world-bank-combined-indicators-for-croatia"">consolidated country dataset</a> on HDX. Climate change is expected to hit developing countries the hardest. Its effects—higher temperatures, changes in preci…"
5a9b3f57-e1c0-4dae-b582-aa2095af40e2,Equatorial Guinea - Health,World Bank Group,World Bank,Creative Commons Attribution International (CC BY),health;hxl;indicators,csv,"Contains data from the World Bank's <a href=""http://data.worldbank.org/"">data portal</a>. There is also a <a href=""https://data.humdata.org/dataset/world-bank-combined-indicators-for-equatorial-guinea"">consolidated country dataset</a> on HDX. Improving health is central to the Millennium Development Goals, and the public sector is the main provider…"
888a1e2d-94d7-4edd-82dd-159b7851779b,Child Poverty Profile,UNICEF Data and Analytics (HQ),"The indicator data draw on inter-agency estimates and nationally representative household surveys such as Multiple Indicator Cluster Surveys (MICS) and Demographic and Health Surveys (DHS). In addition, data from administrative sources and other United Nations organizations have been used. More detailed information on the data sources is provided at https://data.unicef.org/.",CC BY 3.0 IGO,children;covid-19;indicators;poverty,csv;xml,Child Poverty Profile
69cfe4a9-8704-40f0-b30d-f4d3b65cf4c4,South Africa - IFRC Appeals,International Federation of Red Cross and Red Crescent Societies (IFRC),IFRC,Creative Commons Attribution for Intergovernmental Organisations (CC BY-IGO),funding;hxl,csv,"The International Federation of Red Cross and Red Crescent Societies (IFRC) is the world’s largest humanitarian network. Our secretariat supports local Red Cross and Red Crescent action in more than 192 countries, bringing together almost 15 million volunteers for the good of humanity. We launch Emergency Appeals for big and complex disasters affec…"
3a95b1e6-fc79-408f-b4a1-831040d8e1f3,"Satellite-detected flood waters, as of 16 January 2020, over Golmorti, Sistan and Baluchestan Province, I. R. of Iran",United Nations Satellite Centre (UNOSAT),UN Operational Satellite Applications Programme (UNOSAT),Creative Commons Attribution Share-Alike (CC BY-SA),flooding;geodata,geodatabase;shp,"<strong>UNOSAT code: FL20200117IRN</strong> This map illustrates satellite-detected waters in Dalgan County, Sistan and Baluchestan Province, Islamic Republic of Iran, as observed from Sentinel-2 imagery acquired on 16 January 2020. Within the analysed area of 2,130 km2, a total of 647 km2 of land appear to be flooded in Dalgan County. Based on Wor…"
a2260243-108d-4df4-a7e6-a010bcbb553f,Nigeria - Data on Conflict Events,HDX,Uppsala Conflict Data Program,Creative Commons Attribution for Intergovernmental Organisations (CC BY-IGO),conflict-violence;hxl,csv,"This dataset is UCDP's most disaggregated dataset, covering individual events of organized violence (phenomena of lethal violence occurring at a given time and place). These events are sufficiently fine-grained to be geo-coded down to the level of individual villages, with temporal durations disaggregated to single, individual days. Sundberg, Ralph…"
c9e65ffb-5aaf-40b8-9dc3-1054e5d6783e,Eritrea - Private Sector,World Bank Group,World Bank,Creative Commons Attribution International (CC BY),economics;hxl;indicators,csv,"Contains data from the World Bank's <a href=""http://data.worldbank.org/"">data portal</a>. There is also a <a href=""https://data.humdata.org/dataset/world-bank-combined-indicators-for-eritrea"">consolidated country dataset</a> on HDX. Private markets drive economic growth, tapping initiative and investment to create productive jobs and raise incomes.…"
70210ddc-b7eb-48a9-aed6-2180a1bc3009,Norway - Social Development,World Bank Group,World Bank,Creative Commons Attribution International (CC BY),development;hxl;indicators,csv,"Contains data from the World Bank's <a href=""http://data.worldbank.org/"">data portal</a>. There is also a <a href=""https://data.humdata.org/dataset/world-bank-combined-indicators-for-norway"">consolidated country dataset</a> on HDX. Data here cover child labor, gender issues, refugees, and asylum seekers. Children in many countries work long hours, …"
e319f856-e3ca-4a8c-87fa-2f5f7141d8fc,Bolivia (Plurinational State of): Copernicus Vegetation Index Anomaly (FAPAR Anomaly),Copernicus,"European Commission, Joint Research Centre (JRC)",Creative Commons Attribution International (CC BY),drought;environment,geotiff,Fraction of Absorbed Photosynthetically Active Radiation (FAPAR) is a biophysical dimensionless quantity (its values range from 0/no absorption to 1/total absorption) used to assess the greenness and health of vegetation. FAPAR anomalies can be used as an indicator to detect and monitor the impacts of agricultural drought on the growth and producti…
f303e1fb-778e-4ca0-8374-6bb15628d378,Curacao - Private Sector,World Bank Group,World Bank,Creative Commons Attribution International (CC BY),economics;hxl;indicators,csv,"Contains data from the World Bank's <a href=""http://data.worldbank.org/"">data portal</a>. There is also a <a href=""https://data.humdata.org/dataset/world-bank-combined-indicators-for-curacao"">consolidated country dataset</a> on HDX. Private markets drive economic growth, tapping initiative and investment to create productive jobs and raise incomes.…"
c4694c1e-6317-473d-bf8f-4a1bef699633,Guatemala - GCF Funded Activities,Green Climate Fund,Multiple sources,Creative Commons Attribution International (CC BY),climate-weather;funding,csv,"This dataset provides a list of climate funded activities showing the modality, project, name of entity, countries funded, the sector, theme, project size, ESS Category and FA financing."
